{
  "standard_version": "0.9.0",
  "spoke_id": "example-prbs-lab",
  "kind": "data",
  "name": "Example PRBS reactor spoke",
  "granularity": "campaign",
  "stewards": [
    {
      "name": "Example Maintainer",
      "institution": "Example University",
      "role": "data_steward",
      "github": "example-maintainer",
      "orcid": "0000-0002-1825-0097",
      "credit_roles": [
        "data-curation",
        "software"
      ]
    },
    {
      "name": "Example Instrument Owner",
      "institution": "Example University",
      "role": "instrument_owner",
      "github": "example-instrument-owner",
      "orcid": "0000-0002-1825-0098",
      "credit_roles": [
        "investigation",
        "validation"
      ],
      "since": "2026-01-01"
    }
  ],
  "maturity": {
    "rung": "sandbox",
    "notes": "The default for records here that make no claim of their own. A spoke may not claim higher than working, because the rungs above rest on facts about a particular record."
  },
  "layout": {
    "dataset": [
      "manifests",
      "canonical",
      "raw",
      "derived"
    ],
    "calibration": [
      "calibrations"
    ],
    "protocol": [
      "protocols"
    ],
    "sample": [
      "samples"
    ]
  },
  "exclude": [
    "scratch"
  ],
  "strict": false,
  "notes": "A worked example of the manifest, regenerated by make_examples.py."
}
